{
  "gate": "RIG-MVP",
  "spec_files": [
    "docs/mei_ai_after_image_pipeline_v003.md"
  ],
  "spec_sections": [
    "25",
    "26",
    "27",
    "28",
    "29",
    "30",
    "31",
    "32",
    "33",
    "34",
    "35",
    "36",
    "37",
    "38",
    "39"
  ],
  "artifacts": [
    {
      "path": "04_inochi/rig_recipe_v001.json",
      "sha256": "9af9555e9c5ee9b40944a42cce510d1a379880c2b9e920adefec2118b9ea8aa7",
      "present": true
    },
    {
      "path": "04_inochi/mesh_qa_v001.json",
      "sha256": "780868c88c8c7f663cb9c79f950f29904d7c53cf9a0523d3a4db4a135a338ec2",
      "present": true
    },
    {
      "path": "04_inochi/creator_steps_v001.md",
      "sha256": "348bd9633265fe82d7c1d330346f55ec955ac8368dc81f6ca543bcdc0a5c863b",
      "present": true
    }
  ],
  "tests": [
    {
      "id": "rig.recipe_schema",
      "result": "pass",
      "detail": "nodes/pivots/parameters; pivots from assembled PSD"
    },
    {
      "id": "rig.required_parameters_present",
      "result": "pass",
      "detail": "physics empty"
    },
    {
      "id": "rig.mesh_no_outside_alpha",
      "result": "pass",
      "detail": "Face/Body/Hair/Apron/Mouth from final layers"
    },
    {
      "id": "rig.mesh_density_caps",
      "result": "pass",
      "detail": "under cap"
    },
    {
      "id": "rig.pivot_head_below_face_center",
      "result": "pass",
      "detail": "HeadRoot y=423 > FaceCenter y=289"
    },
    {
      "id": "rig.inp_not_overwriting_without_backup",
      "result": "pass",
      "detail": "creator_steps backup"
    }
  ],
  "scores": {},
  "hard_fail": [],
  "soft_fail": [
    "working/mei_mvp.inp missing",
    "Creator Blink/Mouth/Head/Eye screenshots missing",
    "Inochi Creator has no accessibility tree; Orca screenshot captured the wrong monitor"
  ],
  "budget": {
    "full_gen": 1,
    "local_edit": 2,
    "psd_repair": 0,
    "cap": 6
  },
  "spec_drift": [],
  "decision": "RETRY",
  "rollback_to": null,
  "next_gate": "TRACK-OK",
  "reviewer": "agent",
  "human_approved": false,
  "notes": "Recipe, meshes, and RGB rigready PSD are ready. Creator v0.8.6 is running (New Project). Stage A Import/parameters/save still needs a human click. Do not invent INP. human_approved false."
}
