{
  "gate": "RIG-MVP",
  "spec_files": [
    "docs/mei_ai_after_image_pipeline_v003.md"
  ],
  "spec_sections": [
    "25",
    "26",
    "27",
    "28",
    "29",
    "30",
    "31",
    "32",
    "33",
    "34",
    "35",
    "36",
    "37",
    "38",
    "39"
  ],
  "artifacts": [
    {
      "path": "04_inochi/rig_recipe_v001.json",
      "sha256": "3d654705fd152b7cb81213cd4ecb5829ae7a089ecde041ce1892c5752042f948",
      "present": true
    },
    {
      "path": "04_inochi/mesh_qa_v001.json",
      "sha256": "a1f727677f07229decd5f4bc17dd818dde471e505a822eaf15a9634443b2bc11",
      "present": true
    },
    {
      "path": "04_inochi/creator_steps_v001.md",
      "sha256": "93bb7d63aa2ede7daedb30622302339a545dd2cf03a1a6fdeaa9576f5469a44c",
      "present": true
    }
  ],
  "tests": [
    {
      "id": "rig.recipe_schema",
      "result": "pass",
      "detail": "nodes/pivots/parameters"
    },
    {
      "id": "rig.required_parameters_present",
      "result": "pass",
      "detail": "physics empty"
    },
    {
      "id": "rig.mesh_no_outside_alpha",
      "result": "pass",
      "detail": "bootstrap meshes"
    },
    {
      "id": "rig.mesh_density_caps",
      "result": "pass",
      "detail": "under cap"
    },
    {
      "id": "rig.pivot_head_below_face_center",
      "result": "pass",
      "detail": "HeadRoot below FaceCenter"
    },
    {
      "id": "rig.inp_not_overwriting_without_backup",
      "result": "pass",
      "detail": "creator_steps backup"
    }
  ],
  "scores": {},
  "hard_fail": [],
  "soft_fail": [
    "working/mei_mvp.inp and Creator motion screenshots are human Stage A"
  ],
  "budget": {
    "full_gen": 1,
    "local_edit": 2,
    "psd_repair": 0,
    "cap": 6
  },
  "spec_drift": [],
  "decision": "RETRY",
  "rollback_to": null,
  "next_gate": "TRACK-OK",
  "reviewer": "agent",
  "human_approved": false,
  "notes": "Recipe and mesh QA are ready. Creator GUI Stage A is human. Do not PASS until Blink/Mouth/Head/Eye screenshots are in 07_reviews/reports/RIG-MVP/."
}
