{
  "gate": "RIG-MVP",
  "spec_files": [
    "docs/mei_ai_after_image_pipeline_v003.md"
  ],
  "spec_sections": [
    "25",
    "26",
    "27",
    "28",
    "29",
    "30",
    "31",
    "32",
    "33",
    "34",
    "35",
    "36",
    "37",
    "38",
    "39"
  ],
  "artifacts": [
    {
      "path": "04_inochi/rig_recipe_v001.json",
      "sha256": "921ea7e05017effee1a79aa4582f5400d4852ee5e238dabb489f933081a6202a",
      "present": true
    },
    {
      "path": "04_inochi/mesh_qa_v001.json",
      "sha256": "3d95d5feb5de595d9dd2a98aeb4b2395918c80419f3760cb3eb8183a5aabb616",
      "present": true
    },
    {
      "path": "04_inochi/creator_steps_v001.md",
      "sha256": "56ffb50d5b8300adb171c425864b880c19cbef9ed9cee594e109964954efca94",
      "present": true
    },
    {
      "path": "04_inochi/working/may.inx",
      "sha256": "a82546615f4b0836cd805fffafa69336a3189f2c15931aa64bd5c906fe8d900d",
      "present": true
    }
  ],
  "tests": [
    {
      "id": "rig.recipe_schema",
      "result": "pass",
      "detail": "nodes/pivots/parameters"
    },
    {
      "id": "rig.required_parameters_present",
      "result": "pass",
      "detail": "physics empty in recipe"
    },
    {
      "id": "rig.mesh_no_outside_alpha",
      "result": "pass",
      "detail": "bootstrap meshes"
    },
    {
      "id": "rig.mesh_density_caps",
      "result": "pass",
      "detail": "under cap"
    },
    {
      "id": "rig.pivot_head_below_face_center",
      "result": "pass",
      "detail": "HeadRoot world Y below FaceCenter"
    },
    {
      "id": "rig.inp_not_overwriting_without_backup",
      "result": "pass",
      "detail": "creator_steps backup"
    },
    {
      "id": "rig.inx_is_creator_v086",
      "result": "pass",
      "detail": "may.inx TRNSRTS v0.8.6; HeadRoot/NeckRoot/BodyRoot present; 8 params; root children=['BodyRoot', 'Hair_Back', 'Body_Base', 'Dress']"
    }
  ],
  "scores": {},
  "hard_fail": [],
  "soft_fail": [
    "Body parts still under Root; Arm/Skirt not parented to BodyRoot",
    "parameters are 8 default Param #N (want 9 named EyeOpen/Mouth/Head/EyeBall)",
    "parameter names not renamed; bindings empty; atlas textures not merged",
    "screenshots are Creator rest-pose session shots; keyforms not recorded"
  ],
  "budget": {
    "full_gen": 1,
    "local_edit": 2,
    "psd_repair": 0,
    "cap": 6
  },
  "spec_drift": [],
  "decision": "RETRY",
  "rollback_to": null,
  "next_gate": "TRACK-OK",
  "reviewer": "agent",
  "human_approved": false,
  "notes": "Cloud Creator v0.8.6 saved may.inx. Hierarchy: BodyRoot(0,20) > NeckRoot(0,-365) > HeadRoot(0,0) with Face/eyes/mouth/hair/Ahoge as children. 8 parameters created (not renamed, no bindings). Atlas merge and keyforms incomplete. Do not invent INX. human_approved stays false."
}
